ERIC_ID,Title,Authors,Year,Abstract,Journal,Source,DOI,URL,Keywords,Language,Publication_Type
EJ1443902,Constructing a Teacher Portrait for the Artificial Intelligence Age Based on the Micro Ecological System Theory: A Systematic Review,Xiaoyong Hu; Hui Sui; Xingyu Geng; Li Zhao,2024,"Artificial intelligence (AI) is bringing new developments in education. Teachers' professional development grows with the promotion of technology, and more challenges and difficulties will be faced by teachers in the AI age. Thus, this study aimed to explore what a teacher portrait should be like in the new AI age. In order to systematically and comprehensively construct a teacher portrait for the AI age, we searched online databases using keywords, and after screening according to the inclusion and exclusion criteria, 26 journal documents were identified for in-depth analysis. It was found that there were 20 different types of frameworks that could be used to construct a teacher portrait for the AI age. This study reconstructed a teacher portrait based on the Person-Process-Content (PPC) structure of the micro ecological system theory, and finally arrived at a teacher portrait framework with three dimensions and eight sub-dimensions, including teachers' cognition and emotion, teachers' knowledge and skills, and interaction between teachers' cognition and ability, which highlighted the dynamic requirements of teachers' professional development in the AI age. In addition, the challenges faced by teachers in the AI age are mainly concentrated on four aspects: the upgrading of teacher training requirements, the change of educational environment, the teaching application of digital technology, and the ethical issues of artificial intelligence. These findings provide a direction for promoting the professional development of teachers in the AI age, and can help teachers better cope with the challenges of the new age.",Education and Information Technologies,v29 n13 p16679-16715 2024,10.1007/s10639-024-12513-5,http://eric.ed.gov/?id=EJ1443902,Literature Reviews; Artificial Intelligence; Teachers; Teacher Characteristics; Cognitive Processes; Psychological Patterns; Skills; Faculty Development; Technological Literacy; Teacher Education; Educational Environment; Information Technology; Ethics,English,Journal Articles; Information Analyses; Reports - Research
EJ1463902,Responsible AI and Action Learning,Craig Johnson; Emad Mohamed,2025,"This paper proposes action learning has a role to play in advancing responsible AI. Despite the recent surge in attention towards artificial intelligence, predominantly focusing on its technological and commercial aspects, the social dimensions have often been overlooked. Action learning, known for fostering interdisciplinary discourse, is proposed as a collaborative learning approach to foster responsible AI. The paper explores three potential avenues: facilitating multidisciplinary dialogue, reshaping the workforce, and promoting ethical AI practices. Emphasising the importance of cultivating critical questioning skills, we suggest an action learning approach can cultivate the innovative potential of AI, whilst mitigating its potential risks.",Action Learning: Research and Practice,v22 n1 p55-67 2025,10.1080/14767333.2025.2458900,http://eric.ed.gov/?id=EJ1463902,Experiential Learning; Artificial Intelligence; Interdisciplinary Approach; Cooperative Learning; Ethics; Critical Thinking; Innovation; Risk; Labor Force Development,English,Journal Articles; Reports - Descriptive
EJ1486504,Examining High School Students' Artificial Intelligence Literacy in Visual Arts Subjects and Metaverse-Based Digital Art Attitudes,Selma Ceran,2025,"This study aims to examine high school students' artificial intelligence literacy in visual arts subjects and their attitudes toward metaverse-based digital art. The research was conducted using a comparative-relational screening model, one of the screening models. The study sample consisted of 278 9th, 10th, 11th, and 12th grade students. The Visual Themed Artificial Intelligence Literacy Scale and the Metaverse-Based Digital Art Scale were used as data collection tools. According to the research findings, high school students' AI literacy levels in visual subjects were found to be moderate, while their metaverse-based digital art attitudes were found to be low. Analyses conducted by gender revealed that male students had significantly higher mean scores than female students in both AI literacy and metaverse-based digital art attitudes. Comparisons by grade level revealed that 12th grade students had significantly higher AI literacy levels in visual subjects and metaverse-based digital art attitudes than 9th grade students. Regression analysis revealed that AI literacy in visual subjects significantly and positively predicted metaverse-based digital art attitudes, with the model explaining 19.3% of the variance. Based on the research findings, the following recommendations are recommended: developing AI literacy at an early age, integrating the metaverse into visual arts, providing digital pedagogical training for teachers, and enhancing school environments with augmented reality support. Digital ethics should be emphasized in curricula, the STEAM approach should be supported, and intercultural communication should be encouraged through metaverse-based digital art exhibitions. Future research should examine the multidimensional nature of artificial intelligence literacy, and changes in metaverse attitudes should be assessed through longitudinal and experimental studies.",International Journal of Technology in Education,v8 n4 p1245-1265 2025,,http://eric.ed.gov/?id=EJ1486504,Foreign Countries; High School Students; Artificial Intelligence; Visual Arts; Computer Simulation; Technology Uses in Education; Digital Literacy; Gender Differences; Grade Level Differences; Student Attitudes,English,Journal Articles; Reports - Research
EJ1465912,"How Gifted Students Harness AI: Opportunities, Challenges, and Future Prospects",Farah J. Tamim,2025,"In this study, we delve into the opportunities, challenges and prospects of gifted students in middle and secondary school in tapping artificial intelligence (AI). The first part introduces AI and its role in education and discusses how school students need to understand and use AI effectively. The second part examines the concept of giftedness and the characteristics of gifted students. The research employs a mixed-methods approach, administering questionnaires to two groups: It provides gifted students and peers with average IQs. Results show that gifted students often use AI tools (ChatGPT primarily) as tools to advance their learning and to self-explore, whereas, for non-gifted students (average IQ), AI is predominantly used for completing their homework. While all groups can see the value of AI in increasing engagement and motivation, they all also struggle with difficulties, like technical problems and privacy problems. The implications are that personalized feedback and effective inclusion of AI tools within an educational curriculum are both critical. The findings conclude that AI tools should be integrated into school curricula to boost students' ability in personalizing learning, boost learning by means of creativity, and augment technological competence of students. For AI to be effectively integrated, professional development of educators becomes very important. Finally, the study supports for learning environment, which is both collaborative and innovative and uses AI to support students' diverse needs.",International Journal of Research in Education and Science,v11 n1 p129-139 2025,,http://eric.ed.gov/?id=EJ1465912,Middle School Students; High School Students; Artificial Intelligence; Academically Gifted; Gifted Education; Student Motivation; Learner Engagement; Learning Activities; Technical Support; Information Security; Ethics; Creativity; Instructional Development; Technology Integration; Technological Literacy; Professional Development; Individualized Instruction,English,Journal Articles; Reports - Research
EJ1487115,AI Formative Assessment in Saudi Education: A Study across Universities,Abdullah Alenezi; Abdulhameed Alenezi,2025,"Within the context of Saudi Arabia's digital transformation strategy, ""Vision 2030"", the issue of artificial intelligence (AI) adoption in higher education is gaining momentum, changing the form of the formative assessment procedure and its perception. Given the scope of interests in the functions of Arabic Natural Language Processing (NLP) feedback, this study examines the impact of AI-based formative assessment on instructors' flexibility, writing scores, and student engagement in Saudi Arabian institutions. Ten undergraduate students and five faculty members from public and private institutions were invited to participate in the research, which employed a mixed-methods approach to reconstruct classroom settings. Although the qualitative data, gathered through responses in the form of stories, were analyzed using the theme-square approach to identify linguistic and cultural orientations in the interpretation of feedback, the quantitative data, such as revision rates, engagement, and performance ratings, were analyzed using descriptive statistical methods. Although concerns about forcing speakers to use Arabic language technology as a natural language do exist, which are relevant to cultural, linguistic, and fairness issues, the results suggest limited and gradual improvement in the quality and quantity of revisions, resulting in students writing with the assistance of AI-generated feedback. The results offer insight into why culturally specific AI systems are crucial for fostering an equitable culture, delivering practical instruction, and supporting the professional development of faculty members. The current study significantly impacts the ongoing debate about artificial intelligence in education and its consequences for educational settings, especially in non-English-speaking contexts.",Journal of Teaching and Learning,v19 n4 p284-299 2025,,http://eric.ed.gov/?id=EJ1487115,Foreign Countries; Artificial Intelligence; Technology Uses in Education; Higher Education; Educational Technology; Technology Integration; Formative Evaluation; Undergraduate Students; College Faculty; Arabic; Program Effectiveness; Writing (Composition); Cultural Relevance; Learner Engagement; Student Attitudes; Teacher Attitudes; Public Colleges; Private Colleges; Feedback (Response),English,Journal Articles; Reports - Research
EJ1472362,Safeguarding the Digital Economy: Librarians' Perspectives on Data Privacy and Ethical Use of Public AI Chatbots,Abiodun Akinwoye Olusipe; Adebowale Jeremy Adetayo; Augustine I. Enamudu; Oluwaseun Odunayo Babalola,2024,"This study employed a descriptive survey to investigate librarians' perspectives on data privacy and ethical use of public AI chatbots by patrons. The survey of 34 librarians at private university libraries in Nigeria revealed general awareness of applicable laws and privacy risks, but gaps in specific regulatory knowledge like the GDPR. Ethical concerns emerged as paramount, with strong agreement on needs for guidelines around privacy, transparency, consent, and mitigating bias. While initial steps have been taken, major challenges include lack of uniform standards, resource constraints, rapid technology changes, staff training gaps, and difficulties verifying AI vendors' data practices. Key recommendations emphasize developing clear policies prioritizing user consent and data transparency, verifying vendor practices, regular staff training, assessing risks, gathering patron feedback, and cross-institutional collaboration on best practices. Adequate resources and measures safeguarding patron privacy while benefiting from AI capabilities are vital for promoting ethical public AI chatbot use in libraries.",Journal of Electronic Resources Librarianship,v36 n4 p257-270 2024,10.1080/1941126X.2024.2414706,http://eric.ed.gov/?id=EJ1472362,Librarian Attitudes; Privacy; Ethics; Artificial Intelligence; Academic Libraries; Foreign Countries; Private Colleges; Users (Information); Laws; Library Policy; Information Security; Best Practices; Barriers; Library Services; Computer Use,English,Journal Articles; Reports - Research
EJ1461194,AI in Higher Education: Risks and Opportunities from the Academician Perspective,Miray Dogan; Arda Celik; Hasan Arslan,1286,"This research investigates how artificial intelligence (AI) influences higher education, specifically exploring the perspectives of academicians regarding associated risks and opportunities. The study is aimed at the implementation of AI within university settings and its impact on both educators and students. Given the swift integration of AI, notably the widespread adoption of generative AI in higher education, the article emphasises AI's ability to collect detailed data, providing a deeper understanding of academicians' learning experiences. This, in turn, enables personalised support, allowing academicians to respond more effectively to students' needs and improve the overall educational process. Moreover, the research highlights AI's potential to proactively identify students at risk of failure, offering academicians a comprehensive view for more effective assessment. On the other hand, these advantages and the growing dependence on technology pose challenges, including reduced interaction between academicians and students, shifts in workforce dynamics, concerns about student privacy and disparities in technology access. Acknowledging these issues, the study underscores the importance of preparing academicians and students for the evolving landscape of higher education shaped by AI. It stresses the need for proactive measures to navigate these changes effectively, as they are inevitable. The findings of this study are significant for the field of higher education, as they provide a clear and critical assessment of AI's transformative potential and advocate for proactive measures to navigate the changes effectively.",European Journal of Education,v60 n1 e12863 2025,10.1111/ejed.12863,http://eric.ed.gov/?id=EJ1461194,Artificial Intelligence; Technology Uses in Education; Computer Software; Access to Internet; Privacy; Higher Education; College Faculty; College Students; Risk; Learning Experience; Faculty Development; Student Needs; At Risk Students; Academic Failure; Identification; Educational Benefits; Teacher Student Relationship; Labor Force; Social Change; Educational Change; Teacher Attitudes,English,Journal Articles; Reports - Research
EJ1426881,Research-to-Resource: ChatGPT as a Tool in Music Education Research,Debbie Rohwer,2024,"In this research-to-resource article, I introduce possible uses of ChatGPT, an artificial intelligence chatbot developed by OpenAI, for music education research settings. I discuss the impacts of artificial intelligence on education environments and highlight uses of ChatGPT as a tool, including the role of ChatGPT in information gathering, literature review assistance, research design conceptualization, statistical analysis support, research proposal review, and research publication support. I emphasize the importance of human expertise in filling knowledge gaps, detecting incomplete information, and using creative and critical thinking. While acknowledging concerns regarding ethics and plagiarism, I realize the unique qualities of human researchers and the need for purposeful mentoring and training on using artificial intelligence tools for appropriate tasks.",Update: Applications of Research in Music Education,v42 n3 p4-7 2024,10.1177/87551233231210875,http://eric.ed.gov/?id=EJ1426881,Artificial Intelligence; Technology Uses in Education; Natural Language Processing; Music Education; Educational Research; Research Design; Editing; Ethics; Research Tools; Vignettes,English,Journal Articles; Reports - Descriptive
ED652923,Artificial Intelligence in Health Professions Education: Proceedings of a Workshop,Patricia A. Cuff; Erin Hammers Forstag,2023,"The National Academies Global Forum on Innovation in Health Professional Education hosted a multi-day workshop series in March and April 2023 to explore the potential of artificial intelligence (AI) in health professions education. Speakers at the workshops provided background on AI; discussed the social, cultural, policy, legal, and regulatory considerations to integrating AI into health care and training; considered the skills health professionals will need as educators and providers to effectively use AI in practice; and explored needs for educating the next generation of health workers. Speakers took consideration of the bias, burden, health equity concerns that introducing AI into clinical education would bring. This Proceedings of a Workshop summarizes the discussions held during the workshop. [Patricia A. Cuff and Erin Hammers Forstag served as Rapporteurs. Contributors include Global Forum on Innovation in Health Professional Education; Board on Global Health; Health and Medicine Division. Numerous organizations sponsored this work and the full list can be seen in the document.]",National Academies Press,,,http://eric.ed.gov/?id=ED652923,Health Personnel; Allied Health Occupations Education; Artificial Intelligence; Technology Integration; Health Services; Technology Uses in Education,,Books; Collected Works - Proceedings
EJ1481236,Integration of Generative Artificial Intelligence (Gen AI) in Academic Research: Perceptions of Aspiring Educational Leaders,Daryl Ann Borel; Janice L. Taylor,2025,"As aspiring educational leaders, principal candidates must understand the widespread impact of generative artificial intelligence (Gen AI) in education. This qualitative phenomenological study explored the perceptions of aspiring educational leaders regarding Gen AI in academic research, highlighting the ethical concerns and challenges they perceive, revealing potential opportunities for AI integration in education, and assessing how these perceptions may influence their future leadership practices. The theory guiding this study was the distributed cognition theory, as it shows the dynamics of human cognition and AI cognition, making it possible to understand the perceptions of aspiring educational leaders regarding Gen AI integration in academic research. By examining these aspects, the research provided insights into how aspiring educational leaders might approach and implement AI technologies in academic research and education contexts. The research was conducted through a reflection assignment at the end of an introductory research course. The reflection prompts included demographic and background information, perceptions of the ethical use of Gen AI tools, the role of Gen AI tools as research assistants, the effectiveness and challenges related to using Gen AI tools and leveraging Gen AI's potential in education as an aspiring educational leader. The archived reflection data were analyzed using a qualitative phenomenological design method. The study sought to provide insights that could inform professional development, strategies for technological integration, and institutional approaches to Gen AI adoption in academic research courses. The research highlighted how emerging educational leaders perceive Gen AI's role in academic research and educational settings, moving beyond surface-level assessments to understand the complex interplay of technological, pedagogical, and personal factors.",School Leadership Review,v20 n1 Article 11 2025,,http://eric.ed.gov/?id=EJ1481236,Technology Uses in Education; Artificial Intelligence; Man Machine Systems; Natural Language Processing; Administrator Education; Educational Research; Graduate Students; Student Attitudes; Ethics,English,Journal Articles; Reports - Research
EJ1485471,Harnessing AI in School Counselling: Exploring the Potential of ChatGPT for Student Support,Ahmad Al-shraifin; Yousef Wardat; Rommel AlAli; Khaled Al-Saud,2025,"Background/purpose: This study explores the extent to which ChatGPT, an AI-powered large language model, can support school counseling services in addressing students' academic, social, and emotional needs, considering student AI literacy and adoption. It investigates ChatGPT's role in assisting counselors, delivering personalized guidance, ensuring 24/7 availability, and addressing ethical considerations. Materials/Methods: For evaluating its effectiveness in school counseling, the study employed ChatGPT for role-play simulations of interactions and analysis of the literature already published on AI in education. Based on studies concerning technology use in education, the scope of the study included five crucial areas: response time, counselor assistance, tailored student support, ethics, and engagement dimensions, AI literacy, and adoption hurdles. Results: As the study has shown, ChatGPT is capable of providing students tailored recommendations and streamlining office tasks so that the counselors can devote themselves to more complex tasks. Immediate support, especially during times of crisis, is also provided through the AI model's round-the-clock availability. However, effective use depends on students' AI literacy, with training needed to improve prompt engineering skills, and adoption requires user-friendly interfaces and awareness campaigns. Limitations include potential biases in AI responses, data privacy risks, and the necessity for human oversight to maintain empathetic, individualized care. Conclusion: ChatGPT offers significant potential as a supplementary tool in school counseling, enhancing efficiency and accessibility. By addressing student AI literacy and adoption barriers through training and clear communication, its impact can be optimized. However, ethical challenges, including privacy and bias, require careful management. Human counselors remain essential for nuanced, empathetic support. Future research should investigate long-term impacts and establish ethical guidelines for AI integration in educational settings.",Educational Process: International Journal,v18 Article e2025434 2025,,http://eric.ed.gov/?id=EJ1485471,Artificial Intelligence; School Counseling; Program Effectiveness; School Counselors; Technology Uses in Education; Technological Literacy; Barriers; Ethics; Access to Health Care,English,Journal Articles; Reports - Research
EJ1486314,When and How Biases Seep In: Enhancing Debiasing Approaches for Fair Educational Predictive Analytics,Lin Li; Namrata Srivastava; Jia Rong; Quanlong Guan; Dragan Gaševic; Guanliang Chen,2025,"The use of predictive analytics powered by machine learning (ML) to model educational data has increasingly been identified to exhibit bias towards marginalized populations, prompting the need for more equitable applications of these techniques. To tackle bias that emerges in training data or models at different stages of the ML modelling pipeline, numerous debiasing approaches have been proposed. Yet, research into state-of-the-art techniques for effectively employing these approaches to enhance fairness in educational predictive scenarios remains limited. Prior studies often focused on mitigating bias from a single source at a specific stage of model construction within narrowly defined scenarios, overlooking the complexities of bias originating from multiple sources across various stages. Moreover, these approaches were often evaluated using typical threshold-dependent fairness metrics, which fail to account for real-world educational scenarios where thresholds are typically unknown before evaluation. To bridge these gaps, this study systematically examined a total of 28 representative debiasing approaches, categorized by the sources of bias and the stage they targeted, for two critical educational predictive tasks, namely forum post classification and student career prediction. Both tasks involve a two-phase modelling process where features learned from upstream models in the first phase are fed into classical ML models for final predictions, which is a common yet under-explored setting for educational data modelling. The study observed that addressing local stereotypical bias, label bias or proxy discrimination in training data, as well as imposing fairness constraints on models, can effectively enhance predictive fairness. But their efficacy was often compromised when features from upstream models were inherently biased. Beyond that, this study proposes two novel strategies, namely Multi-Stage and Multi-Source debiasing to integrate existing approaches. These strategies demonstrated substantial improvements in mitigating unfairness, underscoring the importance of unified approaches capable of addressing biases from various sources across multiple stages.",British Journal of Educational Technology,v56 n6 p2478-2501 2025,10.1111/bjet.13575,http://eric.ed.gov/?id=EJ1486314,Bias; Attitude Change; Prediction; Learning Analytics; Social Bias; Computer Mediated Communication; Social Media; Stereotypes; Labeling (of Persons),English,Journal Articles; Reports - Research
